{
  "$schema": "https://json-schema.org/draft/2020-12/schema",
  "$id": "https://ricochet.local/schema/measurements.schema.json",
  "title": "ROUNDS frame measurement log",
  "type": "object",
  "additionalProperties": false,
  "required": ["schemaVersion", "targetBuild", "coverage", "measurements"],
  "properties": {
    "$schema": { "const": "./schema/measurements.schema.json" },
    "schemaVersion": { "const": 1 },
    "targetBuild": { "const": "21020021" },
    "coverage": {
      "type": "array",
      "minItems": 1,
      "items": { "$ref": "#/$defs/coverage" }
    },
    "measurements": {
      "type": "array",
      "minItems": 1,
      "items": { "$ref": "#/$defs/measurement" }
    }
  },
  "$defs": {
    "coverage": {
      "type": "object",
      "additionalProperties": false,
      "required": ["metricFactId", "category", "minimumIndependentSources", "rationale"],
      "properties": {
        "metricFactId": { "type": "string", "pattern": "^[a-z][a-z0-9-]+$" },
        "category": { "enum": ["normalization", "movement", "jumping", "bullets", "recoil", "blocking", "camera", "out-of-bounds"] },
        "minimumIndependentSources": { "type": "integer", "minimum": 1 },
        "rationale": { "type": "string", "minLength": 1 },
        "limitation": { "type": "string", "minLength": 1 }
      }
    },
    "measurement": {
      "type": "object",
      "additionalProperties": false,
      "required": ["id", "metricFactId", "source", "sourceTimestamp", "observedFrameIntervalTicks", "activeCards", "modifierControl", "countsTowardCoverage", "pixelMeasurements", "derivation", "normalizedValue", "unit", "tolerance", "confidence", "method"],
      "properties": {
        "id": { "type": "string", "pattern": "^m-[a-z0-9-]+$" },
        "metricFactId": { "type": "string", "pattern": "^[a-z][a-z0-9-]+$" },
        "source": { "type": "string", "pattern": "^[a-z0-9][a-z0-9-]+$" },
        "sourceTimestamp": { "type": "string", "pattern": "^[0-9]{2}:[0-9]{2}:[0-9]{2}([.][0-9]{3})?$" },
        "sourceEndTimestamp": { "type": "string", "pattern": "^[0-9]{2}:[0-9]{2}:[0-9]{2}([.][0-9]{3})?$" },
        "sourceSha256": { "type": "string", "pattern": "^[A-Fa-f0-9]{64}$" },
        "sourceFrameIndexConvention": { "const": "zero-based decoded video frame / PTS" },
        "measurementType": { "enum": ["projectile-frame-span"] },
        "observedFrameIntervalTicks": { "type": "number", "exclusiveMinimum": 0 },
        "activeCards": {
          "type": "array",
          "uniqueItems": true,
          "items": { "type": "string", "minLength": 1 }
        },
        "modifierControl": { "type": "string", "minLength": 1 },
        "countsTowardCoverage": { "type": "boolean" },
        "pixelMeasurements": {
          "type": "object",
          "minProperties": 1,
          "additionalProperties": { "type": "number" }
        },
        "derivation": {
          "type": "object",
          "additionalProperties": false,
          "required": ["operation", "operands"],
          "properties": {
            "operation": { "enum": ["identity", "divide", "multiply"] },
            "operands": {
              "type": "array",
              "minItems": 1,
              "items": {
                "type": "string",
                "pattern": "^(observedFrameIntervalTicks|pixelMeasurements[.][A-Za-z][A-Za-z0-9]*)$"
              }
            }
          }
        },
        "normalizedValue": { "type": "number" },
        "unit": { "type": "string", "minLength": 1 },
        "tolerance": { "type": "number", "minimum": 0 },
        "confidence": { "enum": ["high", "medium", "low"] },
        "method": { "type": "string", "minLength": 1 },
        "notes": { "type": "string", "minLength": 1 }
      }
    }
  }
}
