{
  "$schema": "./schema/measurements.schema.json",
  "schemaVersion": 1,
  "targetBuild": "21020021",
  "coverage": [
    {
      "metricFactId": "player-diameter",
      "category": "normalization",
      "minimumIndependentSources": 2,
      "rationale": "Every spatial measurement depends on a stable body-diameter normalization from both recordings."
    },
    {
      "metricFactId": "player-run-speed",
      "category": "movement",
      "minimumIndependentSources": 1,
      "rationale": "A collision-free 33-frame SSAG floor run with the opponent distant supplies the accepted sustained-movement observation.",
      "limitation": "The WCG comparison overlaps a shot and cannot exclude recoil, so it is retained but excluded; no second action-isolated run was found in the selected recordings."
    },
    {
      "metricFactId": "player-jump-apex-height",
      "category": "jumping",
      "minimumIndependentSources": 1,
      "rationale": "A collision-free SSAG second-duel arc with no movement card supplies the accepted jump-height observation.",
      "limitation": "The WCG comparison contains a shot during the arc, so it is retained but excluded; no second isolated jump was found in the selected recordings."
    },
    {
      "metricFactId": "player-jump-apex-time",
      "category": "jumping",
      "minimumIndependentSources": 1,
      "rationale": "The accepted SSAG arc supplies the visible rise time at the source's two-tick frame resolution.",
      "limitation": "The WCG comparison contains a shot during the arc, so it is retained but excluded; no second action-isolated full arc was found in the selected recordings."
    },
    {
      "metricFactId": "combat-projectile-speed",
      "category": "bullets",
      "minimumIndependentSources": 1,
      "rationale": "The SSAG opening loadout leaves projectile speed unchanged and supplies the accepted base-speed sample.",
      "limitation": "The independent WCG opening uses Thruster and Fast Forward, so its projectile sample is retained as a contaminated comparison and does not count toward coverage."
    },
    {
      "metricFactId": "combat-projectile-radius",
      "category": "bullets",
      "minimumIndependentSources": 1,
      "rationale": "The SSAG opening provides a visible unmodified projectile-core radius.",
      "limitation": "At 640x360 the core is only about three pixels across, so a second recording would not materially improve the broad tolerance without higher-resolution media."
    },
    {
      "metricFactId": "combat-recoil-speed",
      "category": "recoil",
      "minimumIndependentSources": 2,
      "rationale": "Pre-shot and post-shot body velocities from both opening rounds produce a low-confidence recoil impulse band."
    },
    {
      "metricFactId": "combat-block-window",
      "category": "blocking",
      "minimumIndependentSources": 2,
      "rationale": "Both opening loadouts leave block duration unchanged and expose the visible active shield."
    },
    {
      "metricFactId": "camera-horizontal-span",
      "category": "camera",
      "minimumIndependentSources": 2,
      "rationale": "Both recordings use a fixed 16:9 full-stage view with independently measured body scale."
    },
    {
      "metricFactId": "camera-out-of-bounds-result-delay",
      "category": "out-of-bounds",
      "minimumIndependentSources": 1,
      "rationale": "One clean WCG ring-out exposes the boundary-to-result transition.",
      "limitation": "The selected SSAG opening death is projectile-driven rather than an observable ring-out, so no second out-of-bounds sample is claimed."
    }
  ],
  "measurements": [
    {
      "id": "m-player-diameter-wcg",
      "metricFactId": "player-diameter",
      "source": "footage-wcg",
      "sourceTimestamp": "00:00:40.000",
      "observedFrameIntervalTicks": 2.002,
      "activeCards": ["Thruster", "Fast Forward"],
      "modifierControl": "Body scale is presentation-only and is unaffected by the visible starting cards.",
      "countsTowardCoverage": true,
      "pixelMeasurements": { "bodyWidthPixels": 18, "bodyHeightPixels": 18, "frameWidthPixels": 640, "frameHeightPixels": 360, "normalizedUnit": 1.0 },
      "derivation": { "operation": "identity", "operands": ["pixelMeasurements.normalizedUnit"] },
      "normalizedValue": 1.0,
      "unit": "player diameters",
      "tolerance": 0.08,
      "confidence": "medium",
      "method": "Measured the colored circular torso and excluded hat, arm, gun, and nameplate."
    },
    {
      "id": "m-player-diameter-ssag",
      "metricFactId": "player-diameter",
      "source": "footage-ssag",
      "sourceTimestamp": "00:00:28.000",
      "observedFrameIntervalTicks": 2.0,
      "activeCards": ["Tank", "Leech"],
      "modifierControl": "Body scale is presentation-only and is unaffected by the visible starting cards.",
      "countsTowardCoverage": true,
      "pixelMeasurements": { "bodyWidthPixels": 18, "bodyHeightPixels": 17, "frameWidthPixels": 640, "frameHeightPixels": 360, "normalizedUnit": 1.0 },
      "derivation": { "operation": "identity", "operands": ["pixelMeasurements.normalizedUnit"] },
      "normalizedValue": 1.0,
      "unit": "player diameters",
      "tolerance": 0.08,
      "confidence": "medium",
      "method": "Measured the colored circular torso and excluded crown, arm, gun, and nameplate."
    },
    {
      "id": "m-run-speed-wcg",
      "metricFactId": "player-run-speed",
      "source": "footage-wcg",
      "sourceTimestamp": "00:00:46.833",
      "observedFrameIntervalTicks": 2.002,
      "activeCards": ["Thruster", "Fast Forward"],
      "modifierControl": "The visible card text changes bullet behavior but lists no player movement modifier.",
      "countsTowardCoverage": false,
      "pixelMeasurements": { "startCenterX": 126, "endCenterX": 162, "distancePixels": 36, "elapsedFrames": 15, "bodyDiameterPixels": 18 },
      "derivation": { "operation": "divide", "operands": ["pixelMeasurements.distancePixels", "pixelMeasurements.bodyDiameterPixels", "pixelMeasurements.elapsedFrames", "observedFrameIntervalTicks"] },
      "normalizedValue": 0.0666,
      "unit": "player diameters per tick",
      "tolerance": 0.045,
      "confidence": "low",
      "method": "Tracked the orange torso through an early-round airborne traverse as an action-contaminated comparison only.",
      "notes": "This replaces the rejected late-match sample, but the interval overlaps a shot and is excluded because recoil cannot be separated from movement."
    },
    {
      "id": "m-run-speed-ssag",
      "metricFactId": "player-run-speed",
      "source": "footage-ssag",
      "sourceTimestamp": "00:00:42.700",
      "observedFrameIntervalTicks": 2.0,
      "activeCards": ["Tank", "Leech"],
      "modifierControl": "Tank changes health, attack speed, and reload time; Leech grants life steal; neither visible card lists player movement.",
      "countsTowardCoverage": true,
      "pixelMeasurements": { "startCenterX": 99.5152, "endCenterX": 214.1437, "distancePixels": 114.6285, "elapsedFrames": 33, "bodyDiameterPixels": 18 },
      "derivation": { "operation": "divide", "operands": ["pixelMeasurements.distancePixels", "pixelMeasurements.bodyDiameterPixels", "pixelMeasurements.elapsedFrames", "observedFrameIntervalTicks"] },
      "normalizedValue": 0.0965,
      "unit": "player diameters per tick",
      "tolerance": 0.025,
      "confidence": "medium",
      "method": "Tracked the orange torso running right across the second duel's flat floor while the opponent remained distant; the interval ends before takeoff and contains no shot, hit, block, or player contact."
    },
    {
      "id": "m-jump-apex-height-wcg",
      "metricFactId": "player-jump-apex-height",
      "source": "footage-wcg",
      "sourceTimestamp": "00:00:46.500",
      "observedFrameIntervalTicks": 2.002,
      "activeCards": ["Thruster", "Fast Forward"],
      "modifierControl": "The visible card text lists bullet behavior only and no jump or player-movement modifier.",
      "countsTowardCoverage": false,
      "pixelMeasurements": { "startCenterY": 207.27, "apexCenterY": 150.69, "verticalRisePixels": 56.58, "bodyDiameterPixels": 18, "elapsedFrames": 16 },
      "derivation": { "operation": "divide", "operands": ["pixelMeasurements.verticalRisePixels", "pixelMeasurements.bodyDiameterPixels"] },
      "normalizedValue": 3.1433,
      "unit": "player diameters",
      "tolerance": 1.0,
      "confidence": "low",
      "method": "Measured an early-round visible arc from body center to apex as a contaminated comparison only.",
      "notes": "A shot occurs during the arc, so this row is excluded from base-jump coverage."
    },
    {
      "id": "m-jump-apex-height-ssag",
      "metricFactId": "player-jump-apex-height",
      "source": "footage-ssag",
      "sourceTimestamp": "00:00:43.800",
      "observedFrameIntervalTicks": 2.0,
      "activeCards": ["Tank", "Leech"],
      "modifierControl": "Tank and Leech list no jump or player-movement modifier, and both players remain separated through the measured apex.",
      "countsTowardCoverage": true,
      "pixelMeasurements": { "startCenterY": 277.1916, "apexCenterY": 196.0513, "verticalRisePixels": 81.1403, "bodyDiameterPixels": 18, "elapsedFrames": 18 },
      "derivation": { "operation": "divide", "operands": ["pixelMeasurements.verticalRisePixels", "pixelMeasurements.bodyDiameterPixels"] },
      "normalizedValue": 4.5078,
      "unit": "player diameters",
      "tolerance": 0.8,
      "confidence": "low",
      "method": "Measured the orange torso from the last grounded floor frame through its collision-free second-duel apex; no shot, hit, block, platform contact, or player contact occurs during the rise."
    },
    {
      "id": "m-jump-apex-time-wcg",
      "metricFactId": "player-jump-apex-time",
      "source": "footage-wcg",
      "sourceTimestamp": "00:00:46.500",
      "observedFrameIntervalTicks": 2.002,